{
  "actor": {
    "key": "https://login.example.invalid/synthetic|steward-0001",
    "kind": "human",
    "label": "EA Steward (synthetic)",
    "namespace": "oidc"
  },
  "change_reference": "CHG-SYN-0005",
  "channel": "api",
  "created_at": "2026-10-05T09:00:00Z",
  "db_role": "atlas_test_ingest",
  "input_hash": null,
  "kind": "revert",
  "org_id": "01a0c450-6c01-76c4-8c39-8171fd4953d6",
  "reason": "Revert CHG-SYN-0004: the read dependency still exists",
  "reverts_revision": 4,
  "revision": 5,
  "source_ref": "atlas-api"
}
