[
{"actor":{"key":"fixture-loader","kind":"service","label":"Fixture loader","namespace":"atlas.service"},"change_reference":null,"channel":"fixture_cli","created_at":"2026-10-01T09:00:00Z","db_role":"atlas_test_ingest","input_hash":"sha256:892ee536d6252503fe23fbc4ae5b6b83c0d57b28b68e0a6f88ca41945ffcf6c4","kind":"fixture_load","org_id":"01a0c450-6c01-76c4-8c39-8171fd4953d6","reason":"Golden fixture baseline (synthetic)","reverts_revision":null,"revision":1,"source_ref":"fixture:canonical-golden-v1"},
{"actor":{"key":"import-worker","kind":"service","label":"Import worker","namespace":"atlas.service"},"change_reference":"CHG-SYN-0002","channel":"import","created_at":"2026-10-02T09:00:00Z","db_role":"atlas_test_ingest","input_hash":"sha256:8860e64862dc22700c580446ba406f8c2ba4afada67cc91c9a7549e5a2ab139e","kind":"import","org_id":"01a0c450-6c01-76c4-8c39-8171fd4953d6","reason":"AWS inventory import (synthetic)","reverts_revision":null,"revision":2,"source_ref":"aws-config (synthetic export)"},
{"actor":{"key":"https://login.example.invalid/synthetic|steward-0001","kind":"human","label":"EA Steward (synthetic)","namespace":"oidc"},"change_reference":"CHG-SYN-0003","channel":"api","created_at":"2026-10-03T09:00:00Z","db_role":"atlas_test_ingest","input_hash":null,"kind":"steward_edit","org_id":"01a0c450-6c01-76c4-8c39-8171fd4953d6","reason":"Rename after product renaming; move underwriting ownership to the data team","reverts_revision":null,"revision":3,"source_ref":"atlas-api"},
{"actor":{"key":"https://login.example.invalid/synthetic|steward-0001","kind":"human","label":"EA Steward (synthetic)","namespace":"oidc"},"change_reference":"CHG-SYN-0004","channel":"api","created_at":"2026-10-04T09:00:00Z","db_role":"atlas_test_ingest","input_hash":null,"kind":"steward_edit","org_id":"01a0c450-6c01-76c4-8c39-8171fd4953d6","reason":"Claims API no longer reads policy records","reverts_revision":null,"revision":4,"source_ref":"atlas-api"},
{"actor":{"key":"https://login.example.invalid/synthetic|steward-0001","kind":"human","label":"EA Steward (synthetic)","namespace":"oidc"},"change_reference":"CHG-SYN-0005","channel":"api","created_at":"2026-10-05T09:00:00Z","db_role":"atlas_test_ingest","input_hash":null,"kind":"revert","org_id":"01a0c450-6c01-76c4-8c39-8171fd4953d6","reason":"Revert CHG-SYN-0004: the read dependency still exists","reverts_revision":4,"revision":5,"source_ref":"atlas-api"},
{"actor":{"key":"https://login.example.invalid/synthetic|steward-0001","kind":"human","label":"EA Steward (synthetic)","namespace":"oidc"},"change_reference":"CHG-SYN-0006","channel":"api","created_at":"2026-10-06T09:00:00Z","db_role":"atlas_test_ingest","input_hash":null,"kind":"steward_edit","org_id":"01a0c450-6c01-76c4-8c39-8171fd4953d6","reason":"Link the billing database to its ARM resource and re-type it","reverts_revision":null,"revision":6,"source_ref":"atlas-api"},
{"actor":{"key":"taxonomy-migration","kind":"system","label":"Taxonomy migration","namespace":"atlas.system"},"change_reference":null,"channel":"migration","created_at":"2026-10-07T09:00:00Z","db_role":"atlas_test_ingest","input_hash":null,"kind":"migration","org_id":"01a0c450-6c01-76c4-8c39-8171fd4953d6","reason":"Apply native type mapping bigquery Dataset -> data_store","reverts_revision":null,"revision":7,"source_ref":"taxonomy 1.2.0-test.1 (synthetic)"},
{"actor":{"key":"import-worker","kind":"service","label":"Import worker","namespace":"atlas.service"},"change_reference":"CHG-SYN-0008","channel":"import","created_at":"2026-10-08T09:00:00Z","db_role":"atlas_test_ingest","input_hash":"sha256:28238bf447a0765315a9e3443b1498821140f8d2638fb8f5f051952eb32b7b39","kind":"import","org_id":"01a0c450-6c01-76c4-8c39-8171fd4953d6","reason":"Analytics IaC import (synthetic)","reverts_revision":null,"revision":8,"source_ref":"IaC manifests: analytics (synthetic)"},
{"actor":{"key":"fixture-loader","kind":"service","label":"Fixture loader","namespace":"atlas.service"},"change_reference":null,"channel":"fixture_cli","created_at":"2026-10-01T09:00:00Z","db_role":"atlas_test_ingest","input_hash":"sha256:4de9fa5d2db243d6933ce237c2d0f90e889180e6c77d745df1ccaa082cb83d76","kind":"fixture_load","org_id":"01a0c451-2f51-7a36-a945-b5532f313ef4","reason":"Golden fixture baseline, second organization (synthetic)","reverts_revision":null,"revision":1,"source_ref":"fixture:canonical-golden-v1"}
]
